{"certificate_ids":[],"command_manifest":{"args":["normalize"],"command":"ckc"},"content_hash":"sha256:ff00000000000000000000000000000000000000000000000000000000000001","parent_hashes":[],"producer_version":"ckc-core/0.0.0","replay_command":"ckc normalize --bundle test","schema_version":"0.0.0","semantic_profiles":["CKC-Norm","CKC-Defeasible"],"source_input_hashes":["sha256:ee00000000000000000000000000000000000000000000000000000000000001"],"stage":"normalize"}